<?xml version="1.0" encoding="UTF-8"?>
<!--
  Copyright 1999-2004 The Apache Software Foundation

  Licensed under the Apache License, Version 2.0 (the "License");
  you may not use this file except in compliance with the License.
  You may obtain a copy of the License at

      http://www.apache.org/licenses/LICENSE-2.0

  Unless required by applicable law or agreed to in writing, software
  distributed under the License is distributed on an "AS IS" BASIS,
  WITHOUT WARRANTIES OR CONDITIONS OF ANY KIND, either express or implied.
  See the License for the specific language governing permissions and
  limitations under the License.
-->
<!DOCTYPE document PUBLIC "-//APACHE//DTD Documentation V1.0//EN" "../dtd/document-v10.dtd">

<document>
<header>
<title>Cocoon FAQs</title>
<subtitle>Overview</subtitle>
<authors>
<person name="Diana Shannon" email="shannon@apache.org"/>
</authors>
</header>

<body>
 
 <s1 title="Overview">

<p>
This is a collection of FAQs. The Cocooon project is actively seeking additional FAQ contributors to expand this collection. For information on how to write your own FAQ, please see <link href="../howto/howto-author-faq.html">How to Write your own FAQ.</link>
</p>

	</s1>

 <s1 title="FAQs">

 <s2 title="Getting Started">

	<ul>
<li><link href="faq-install.html">Installing Cocoon</link></li>
<li><link href="faq-configure-environment.html">Configuring the Cocoon Environment</link></li>
<li><link href="faq-cvs.html">CVS</link></li>

	</ul>
</s2>

 <s2 title="Using Cocoon">
	<ul>
<li><link href="faq-configure-c2.html">Configuring Cocoon</link></li>
<li><link href="faq-databases.html">Databases</link></li>
<li><link href="faq-xsp.html">XSP</link></li>
<!-- <li><link href="faq-xmlform.html">XMLForm</link></li> -->
<li><link href="faq-xslt.html">XSLT</link></li>
<li><link href="faq-debugging.html">Debugging</link></li>
	</ul>
</s2>

 <s2 title="The Sitemap and its Components">
	<ul>
<li><link href="faq-sitemap.html">Sitemap</link></li>
<li><link href="faq-generators.html">Generators</link></li>
<li><link href="faq-transformers.html">Transformers</link></li>
<li><link href="faq-serializers.html">Serializers</link></li>
<li><link href="faq-matchers.html">Matchers</link></li>
<li><link href="faq-selectors.html">Selectors</link></li>
<li><link href="faq-actions.html">Actions</link></li>
<li><link href="faq-aggregators.html">Aggregators</link></li>
	</ul>
</s2>

<!-- <s2 title="Contributing">
	<ul>
<li><link href="faq-docs.html">Documentation</link></li>
	</ul>
</s2> -->




 </s1>
 


 </body>
</document>
